<?xml version="1.0" encoding="UTF-8"?><!DOCTYPE Manifest [ 
<!ELEMENT Manifest (asup:TABLE_INFO,asup:ROW*,asup:ABORT?)>
<!ATTLIST Manifest xmlns CDATA #FIXED 'http://asup_search.netapp.com/ns/Manifest/1.0'>
<!ATTLIST Manifest xmlns:asup CDATA #FIXED 'http://asup_search.netapp.com/ns/ASUP/1.0'>
<!ATTLIST Manifest smf_table_name CDATA #REQUIRED>
<!ATTLIST Manifest smf_table_desc CDATA #REQUIRED>
<!ATTLIST Manifest col_time_us CDATA #REQUIRED>
<!ATTLIST Manifest ocum_uuid CDATA #REQUIRED>
<!ELEMENT asup:TABLE_INFO (asup:field+)>
<!ELEMENT asup:field (asup:tag,asup:smf_name,asup:ui_name,asup:type,asup:qualification,asup:remap)>
<!ELEMENT asup:tag (#PCDATA)>
<!ELEMENT asup:smf_name (#PCDATA)>
<!ELEMENT asup:ui_name (#PCDATA)>
<!ELEMENT asup:type (#PCDATA)>
<!ELEMENT asup:qualification (#PCDATA)>
<!ELEMENT asup:remap (#PCDATA)>
<!ELEMENT asup:ABORT (#PCDATA)>
<!ELEMENT asup:ROW (seq-num,prio-num,subsys,cmd-tgt,body-file,size-collected,time-collected,status,error,content-type)>
<!ATTLIST asup:ROW col_time_us CDATA #REQUIRED>
<!ELEMENT seq-num (#PCDATA)>
<!ELEMENT prio-num (#PCDATA)>
<!ELEMENT subsys (#PCDATA)>
<!ELEMENT cmd-tgt (#PCDATA)>
<!ELEMENT body-file (#PCDATA)>
<!ELEMENT size-collected (#PCDATA)>
<!ELEMENT time-collected (#PCDATA)>
<!ELEMENT status (#PCDATA)>
<!ELEMENT error (#PCDATA)>
<!ELEMENT content-type (#PCDATA)>
]>
<Manifest col_time_us="1415201299332" ocum_uuid="61073e8c-abe2-4488-a44e-46c53df92590" xmlns="http://asup_search.netapp.com/ns/Manifest/1.0" xmlns:asup="http://asup_search.netapp.com/ns/ASUP/1.0">
   <asup:TABLE_INFO>
      <asup:field>
         <asup:tag>seq-num</asup:tag>
         <asup:smf_name>seq-num</asup:smf_name>
         <asup:ui_name>Sequence Number</asup:ui_name>
         <asup:type>seqnum</asup:type>
         <asup:qualification>key</asup:qualification>
         <asup:remap>noop</asup:remap>
      </asup:field>
      <asup:field>
         <asup:tag>prio-num</asup:tag>
         <asup:smf_name>prio-num</asup:smf_name>
         <asup:ui_name>Collection Order</asup:ui_name>
         <asup:type>unsigned</asup:type>
         <asup:qualification>key</asup:qualification>
         <asup:remap>noop</asup:remap>
      </asup:field>
      <asup:field>
         <asup:tag>cmd-tgt</asup:tag>
         <asup:smf_name>cmd-tgt</asup:smf_name>
         <asup:ui_name>Execution domain for command</asup:ui_name>
         <asup:type>AutoSupport_cmd_tgt</asup:type>
         <asup:qualification>read</asup:qualification>
         <asup:remap>noop</asup:remap>
      </asup:field>
      <asup:field>
         <asup:tag>body-file</asup:tag>
         <asup:smf_name>body-file</asup:smf_name>
         <asup:ui_name>The AutoSupport Content filename for this data</asup:ui_name>
         <asup:type>text</asup:type>
         <asup:qualification>read</asup:qualification>
         <asup:remap>noop</asup:remap>
      </asup:field>
      <asup:field>
         <asup:tag>size-collected</asup:tag>
         <asup:smf_name>size-collected</asup:smf_name>
         <asup:ui_name>Number of bytes collected</asup:ui_name>
         <asup:type>size</asup:type>
         <asup:qualification>read</asup:qualification>
         <asup:remap>noop</asup:remap>
      </asup:field>
      <asup:field>
         <asup:tag>time-collected</asup:tag>
         <asup:smf_name>time-collected</asup:smf_name>
         <asup:ui_name>Time spent collecting</asup:ui_name>
         <asup:type>unsigned64</asup:type>
         <asup:qualification>read</asup:qualification>
         <asup:remap>noop</asup:remap>
      </asup:field>
      <asup:field>
         <asup:tag>status</asup:tag>
         <asup:smf_name>status</asup:smf_name>
         <asup:ui_name>The status of this data item</asup:ui_name>
         <asup:type>asup_manifest_status</asup:type>
         <asup:qualification>read</asup:qualification>
         <asup:remap>noop</asup:remap>
      </asup:field>
      <asup:field>
         <asup:tag>error</asup:tag>
         <asup:smf_name>error</asup:smf_name>
         <asup:ui_name>The textual description of error</asup:ui_name>
         <asup:type>text</asup:type>
         <asup:qualification>read</asup:qualification>
         <asup:remap>noop</asup:remap>
      </asup:field>
      <asup:field>
         <asup:tag>content-type</asup:tag>
         <asup:smf_name>content-type</asup:smf_name>
         <asup:ui_name>The AutoSupport content type for this data</asup:ui_name>
         <asup:type>asup_content_type</asup:type>
         <asup:qualification>read</asup:qualification>
         <asup:remap>noop</asup:remap>
      </asup:field>
   </asup:TABLE_INFO>
   <asup:ROW>
      <error>
      </error>
      <body-file>diagnostic-command-output-df.out.txt</body-file>
      <time-collected>47</time-collected>
      <cmd-tgt>os</cmd-tgt>
      <content-type>basic</content-type>
      <status>completed</status>
      <size-collected>559</size-collected>
      <prio-num>1</prio-num>
      <seq-num>32</seq-num>
   </asup:ROW>
   <asup:ROW>
      <error>
      </error>
      <body-file>diagnostic-command-output-ps.out.txt</body-file>
      <time-collected>17</time-collected>
      <cmd-tgt>os</cmd-tgt>
      <content-type>basic</content-type>
      <status>completed</status>
      <size-collected>14682</size-collected>
      <prio-num>2</prio-num>
      <seq-num>32</seq-num>
   </asup:ROW>
   <asup:ROW>
      <error>
      </error>
      <body-file>diagnostic-command-output-dpkg.out.txt</body-file>
      <time-collected>24</time-collected>
      <cmd-tgt>os</cmd-tgt>
      <content-type>basic</content-type>
      <status>completed</status>
      <size-collected>22777</size-collected>
      <prio-num>3</prio-num>
      <seq-num>32</seq-num>
   </asup:ROW>
   <asup:ROW>
      <error>
      </error>
      <body-file>diagnostic-command-output-dpkg-ocum.out.txt</body-file>
      <time-collected>13</time-collected>
      <cmd-tgt>os</cmd-tgt>
      <content-type>basic</content-type>
      <status>completed</status>
      <size-collected>510</size-collected>
      <prio-num>4</prio-num>
      <seq-num>32</seq-num>
   </asup:ROW>
   <asup:ROW>
      <error>
      </error>
      <body-file>diagnostic-command-output-dpkg-ocie-au.out.txt</body-file>
      <time-collected>13</time-collected>
      <cmd-tgt>os</cmd-tgt>
      <content-type>basic</content-type>
      <status>completed</status>
      <size-collected>307</size-collected>
      <prio-num>5</prio-num>
      <seq-num>32</seq-num>
   </asup:ROW>
   <asup:ROW>
      <error>
      </error>
      <body-file>diagnostic-command-output-dpkg-ocie-server.out.txt</body-file>
      <time-collected>14</time-collected>
      <cmd-tgt>os</cmd-tgt>
      <content-type>basic</content-type>
      <status>completed</status>
      <size-collected>321</size-collected>
      <prio-num>6</prio-num>
      <seq-num>32</seq-num>
   </asup:ROW>
   <asup:ROW>
      <error>
      </error>
      <body-file>diagnostic-command-output-dpkg-ocie-serverbase.out.txt</body-file>
      <time-collected>13</time-collected>
      <cmd-tgt>os</cmd-tgt>
      <content-type>basic</content-type>
      <status>completed</status>
      <size-collected>327</size-collected>
      <prio-num>7</prio-num>
      <seq-num>32</seq-num>
   </asup:ROW>
   <asup:ROW>
      <error>
      </error>
      <body-file>diagnostic-command-output-cpuinfo.out.txt</body-file>
      <time-collected>4</time-collected>
      <cmd-tgt>os</cmd-tgt>
      <content-type>basic</content-type>
      <status>completed</status>
      <size-collected>2653</size-collected>
      <prio-num>8</prio-num>
      <seq-num>32</seq-num>
   </asup:ROW>
   <asup:ROW>
      <error>
      </error>
      <body-file>diagnostic-command-output-meminfo.out.txt</body-file>
      <time-collected>5</time-collected>
      <cmd-tgt>os</cmd-tgt>
      <content-type>basic</content-type>
      <status>completed</status>
      <size-collected>1175</size-collected>
      <prio-num>9</prio-num>
      <seq-num>32</seq-num>
   </asup:ROW>
   <asup:ROW>
      <error>
      </error>
      <body-file>diagnostic-command-output-ifconfig.out.txt</body-file>
      <time-collected>5</time-collected>
      <cmd-tgt>os</cmd-tgt>
      <content-type>basic</content-type>
      <status>completed</status>
      <size-collected>970</size-collected>
      <prio-num>10</prio-num>
      <seq-num>32</seq-num>
   </asup:ROW>
   <asup:ROW>
      <error>
      </error>
      <body-file>diagnostic-command-output-netstat.out.txt</body-file>
      <time-collected>21</time-collected>
      <cmd-tgt>os</cmd-tgt>
      <content-type>basic</content-type>
      <status>completed</status>
      <size-collected>6886</size-collected>
      <prio-num>11</prio-num>
      <seq-num>32</seq-num>
   </asup:ROW>
   <asup:ROW>
      <error>
      </error>
      <body-file>diagnostic-command-output-route.out.txt</body-file>
      <time-collected>7</time-collected>
      <cmd-tgt>os</cmd-tgt>
      <content-type>basic</content-type>
      <status>completed</status>
      <size-collected>277</size-collected>
      <prio-num>12</prio-num>
      <seq-num>32</seq-num>
   </asup:ROW>
   <asup:ROW>
      <error>
      </error>
      <body-file>diagnostic-command-output-uptime.out.txt</body-file>
      <time-collected>5</time-collected>
      <cmd-tgt>os</cmd-tgt>
      <content-type>basic</content-type>
      <status>completed</status>
      <size-collected>93</size-collected>
      <prio-num>13</prio-num>
      <seq-num>32</seq-num>
   </asup:ROW>
   <asup:ROW>
      <error>
      </error>
      <body-file>diagnostic-command-output-free.out.txt</body-file>
      <time-collected>6</time-collected>
      <cmd-tgt>os</cmd-tgt>
      <content-type>basic</content-type>
      <status>completed</status>
      <size-collected>250</size-collected>
      <prio-num>14</prio-num>
      <seq-num>32</seq-num>
   </asup:ROW>
   <asup:ROW>
      <error>
      </error>
      <body-file>diagnostic-command-output-hostname.out.txt</body-file>
      <time-collected>6</time-collected>
      <cmd-tgt>os</cmd-tgt>
      <content-type>basic</content-type>
      <status>completed</status>
      <size-collected>49</size-collected>
      <prio-num>15</prio-num>
      <seq-num>32</seq-num>
   </asup:ROW>
   <asup:ROW>
      <error>
      </error>
      <body-file>diagnostic-command-output-uname.out.txt</body-file>
      <time-collected>6</time-collected>
      <cmd-tgt>os</cmd-tgt>
      <content-type>basic</content-type>
      <status>completed</status>
      <size-collected>113</size-collected>
      <prio-num>16</prio-num>
      <seq-num>32</seq-num>
   </asup:ROW>
   <asup:ROW>
      <error>
      </error>
      <body-file>diagnostic-command-output-locale.out.txt</body-file>
      <time-collected>4</time-collected>
      <cmd-tgt>os</cmd-tgt>
      <content-type>basic</content-type>
      <status>completed</status>
      <size-collected>33</size-collected>
      <prio-num>17</prio-num>
      <seq-num>32</seq-num>
   </asup:ROW>
   <asup:ROW>
      <error>
      </error>
      <body-file>diagnostic-command-output-ulimit.out.txt</body-file>
      <time-collected>5</time-collected>
      <cmd-tgt>os</cmd-tgt>
      <content-type>basic</content-type>
      <status>completed</status>
      <size-collected>342</size-collected>
      <prio-num>18</prio-num>
      <seq-num>32</seq-num>
   </asup:ROW>
   <asup:ROW>
      <error>
      </error>
      <body-file>database-dumps-database-dump.sql.7z</body-file>
      <time-collected>44600</time-collected>
      <cmd-tgt>file</cmd-tgt>
      <content-type>troubleshooting</content-type>
      <status>completed</status>
      <size-collected>8416662</size-collected>
      <prio-num>19</prio-num>
      <seq-num>32</seq-num>
   </asup:ROW>
   <asup:ROW>
      <error>
      </error>
      <body-file>database-dumps-database-dump.err</body-file>
      <time-collected>44600</time-collected>
      <cmd-tgt>file</cmd-tgt>
      <content-type>troubleshooting</content-type>
      <status>completed</status>
      <size-collected>92</size-collected>
      <prio-num>20</prio-num>
      <seq-num>32</seq-num>
   </asup:ROW>
   <asup:ROW>
      <error>
      </error>
      <body-file>heapDump.hprof</body-file>
      <time-collected>19055</time-collected>
      <cmd-tgt>file</cmd-tgt>
      <content-type>troubleshooting</content-type>
      <status>completed</status>
      <size-collected>870716686</size-collected>
      <prio-num>21</prio-num>
      <seq-num>32</seq-num>
   </asup:ROW>
   <asup:ROW>
      <error>
      </error>
      <body-file>oncommand-um-logs-2014-10-24-audit.0.gz</body-file>
      <time-collected>
      </time-collected>
      <cmd-tgt>file</cmd-tgt>
      <content-type>basic</content-type>
      <status>completed</status>
      <size-collected>8219</size-collected>
      <prio-num>22</prio-num>
      <seq-num>32</seq-num>
   </asup:ROW>
   <asup:ROW>
      <error>
      </error>
      <body-file>oncommand-um-logs-2014-10-24-ocumserver-debug.0.gz</body-file>
      <time-collected>
      </time-collected>
      <cmd-tgt>file</cmd-tgt>
      <content-type>basic</content-type>
      <status>completed</status>
      <size-collected>4286417</size-collected>
      <prio-num>23</prio-num>
      <seq-num>32</seq-num>
   </asup:ROW>
   <asup:ROW>
      <error>
      </error>
      <body-file>oncommand-um-logs-2014-10-24-ocumserver.0.gz</body-file>
      <time-collected>
      </time-collected>
      <cmd-tgt>file</cmd-tgt>
      <content-type>basic</content-type>
      <status>completed</status>
      <size-collected>86367</size-collected>
      <prio-num>24</prio-num>
      <seq-num>32</seq-num>
   </asup:ROW>
   <asup:ROW>
      <error>
      </error>
      <body-file>oncommand-um-logs-2014-11-04-audit.0.gz</body-file>
      <time-collected>
      </time-collected>
      <cmd-tgt>file</cmd-tgt>
      <content-type>basic</content-type>
      <status>completed</status>
      <size-collected>12151</size-collected>
      <prio-num>25</prio-num>
      <seq-num>32</seq-num>
   </asup:ROW>
   <asup:ROW>
      <error>
      </error>
      <body-file>oncommand-um-logs-2014-11-04-ocumserver-debug.0.gz</body-file>
      <time-collected>
      </time-collected>
      <cmd-tgt>file</cmd-tgt>
      <content-type>basic</content-type>
      <status>completed</status>
      <size-collected>6312063</size-collected>
      <prio-num>26</prio-num>
      <seq-num>32</seq-num>
   </asup:ROW>
   <asup:ROW>
      <error>
      </error>
      <body-file>oncommand-um-logs-2014-11-04-ocumserver.0.gz</body-file>
      <time-collected>
      </time-collected>
      <cmd-tgt>file</cmd-tgt>
      <content-type>basic</content-type>
      <status>completed</status>
      <size-collected>99123</size-collected>
      <prio-num>27</prio-num>
      <seq-num>32</seq-num>
   </asup:ROW>
   <asup:ROW>
      <error>
      </error>
      <body-file>oncommand-um-logs-2014-10-10-audit.0.gz</body-file>
      <time-collected>
      </time-collected>
      <cmd-tgt>file</cmd-tgt>
      <content-type>basic</content-type>
      <status>completed</status>
      <size-collected>13158</size-collected>
      <prio-num>28</prio-num>
      <seq-num>32</seq-num>
   </asup:ROW>
   <asup:ROW>
      <error>
      </error>
      <body-file>oncommand-um-logs-2014-10-10-ocumserver-debug.0.gz</body-file>
      <time-collected>
      </time-collected>
      <cmd-tgt>file</cmd-tgt>
      <content-type>basic</content-type>
      <status>completed</status>
      <size-collected>6260387</size-collected>
      <prio-num>29</prio-num>
      <seq-num>32</seq-num>
   </asup:ROW>
   <asup:ROW>
      <error>
      </error>
      <body-file>oncommand-um-logs-2014-10-10-ocumserver.0.gz</body-file>
      <time-collected>
      </time-collected>
      <cmd-tgt>file</cmd-tgt>
      <content-type>basic</content-type>
      <status>completed</status>
      <size-collected>99450</size-collected>
      <prio-num>30</prio-num>
      <seq-num>32</seq-num>
   </asup:ROW>
   <asup:ROW>
      <error>
      </error>
      <body-file>oncommand-um-logs-2014-10-13-audit.0.gz</body-file>
      <time-collected>
      </time-collected>
      <cmd-tgt>file</cmd-tgt>
      <content-type>basic</content-type>
      <status>completed</status>
      <size-collected>11621</size-collected>
      <prio-num>31</prio-num>
      <seq-num>32</seq-num>
   </asup:ROW>
   <asup:ROW>
      <error>
      </error>
      <body-file>oncommand-um-logs-2014-10-13-ocumserver-debug.0.gz</body-file>
      <time-collected>
      </time-collected>
      <cmd-tgt>file</cmd-tgt>
      <content-type>basic</content-type>
      <status>completed</status>
      <size-collected>6111863</size-collected>
      <prio-num>32</prio-num>
      <seq-num>32</seq-num>
   </asup:ROW>
   <asup:ROW>
      <error>
      </error>
      <body-file>oncommand-um-logs-2014-10-13-ocumserver.0.gz</body-file>
      <time-collected>
      </time-collected>
      <cmd-tgt>file</cmd-tgt>
      <content-type>basic</content-type>
      <status>completed</status>
      <size-collected>99834</size-collected>
      <prio-num>33</prio-num>
      <seq-num>32</seq-num>
   </asup:ROW>
   <asup:ROW>
      <error>
      </error>
      <body-file>oncommand-um-logs-2014-11-01-ocumserver-debug.0.gz</body-file>
      <time-collected>
      </time-collected>
      <cmd-tgt>file</cmd-tgt>
      <content-type>basic</content-type>
      <status>completed</status>
      <size-collected>4370634</size-collected>
      <prio-num>34</prio-num>
      <seq-num>32</seq-num>
   </asup:ROW>
   <asup:ROW>
      <error>
      </error>
      <body-file>oncommand-um-logs-2014-11-01-audit.0.gz</body-file>
      <time-collected>
      </time-collected>
      <cmd-tgt>file</cmd-tgt>
      <content-type>basic</content-type>
      <status>completed</status>
      <size-collected>21068</size-collected>
      <prio-num>35</prio-num>
      <seq-num>32</seq-num>
   </asup:ROW>
   <asup:ROW>
      <error>
      </error>
      <body-file>oncommand-um-logs-2014-11-01-ocumserver.0.gz</body-file>
      <time-collected>
      </time-collected>
      <cmd-tgt>file</cmd-tgt>
      <content-type>basic</content-type>
      <status>completed</status>
      <size-collected>86475</size-collected>
      <prio-num>36</prio-num>
      <seq-num>32</seq-num>
   </asup:ROW>
   <asup:ROW>
      <error>
      </error>
      <body-file>oncommand-um-logs-2014-10-27-audit.0.gz</body-file>
      <time-collected>
      </time-collected>
      <cmd-tgt>file</cmd-tgt>
      <content-type>basic</content-type>
      <status>completed</status>
      <size-collected>8247</size-collected>
      <prio-num>37</prio-num>
      <seq-num>32</seq-num>
   </asup:ROW>
   <asup:ROW>
      <error>
      </error>
      <body-file>oncommand-um-logs-2014-10-27-ocumserver-debug.0.gz</body-file>
      <time-collected>
      </time-collected>
      <cmd-tgt>file</cmd-tgt>
      <content-type>basic</content-type>
      <status>completed</status>
      <size-collected>4254280</size-collected>
      <prio-num>38</prio-num>
      <seq-num>32</seq-num>
   </asup:ROW>
   <asup:ROW>
      <error>
      </error>
      <body-file>oncommand-um-logs-2014-10-27-ocumserver.0.gz</body-file>
      <time-collected>
      </time-collected>
      <cmd-tgt>file</cmd-tgt>
      <content-type>basic</content-type>
      <status>completed</status>
      <size-collected>88011</size-collected>
      <prio-num>39</prio-num>
      <seq-num>32</seq-num>
   </asup:ROW>
   <asup:ROW>
      <error>
      </error>
      <body-file>oncommand-um-logs-2014-10-28-audit.0.gz</body-file>
      <time-collected>
      </time-collected>
      <cmd-tgt>file</cmd-tgt>
      <content-type>basic</content-type>
      <status>completed</status>
      <size-collected>6856</size-collected>
      <prio-num>40</prio-num>
      <seq-num>32</seq-num>
   </asup:ROW>
   <asup:ROW>
      <error>
      </error>
      <body-file>oncommand-um-logs-2014-10-28-ocumserver-debug.0.gz</body-file>
      <time-collected>
      </time-collected>
      <cmd-tgt>file</cmd-tgt>
      <content-type>basic</content-type>
      <status>completed</status>
      <size-collected>4279033</size-collected>
      <prio-num>41</prio-num>
      <seq-num>32</seq-num>
   </asup:ROW>
   <asup:ROW>
      <error>
      </error>
      <body-file>oncommand-um-logs-2014-10-28-ocumserver.0.gz</body-file>
      <time-collected>
      </time-collected>
      <cmd-tgt>file</cmd-tgt>
      <content-type>basic</content-type>
      <status>completed</status>
      <size-collected>86456</size-collected>
      <prio-num>42</prio-num>
      <seq-num>32</seq-num>
   </asup:ROW>
   <asup:ROW>
      <error>
      </error>
      <body-file>oncommand-um-logs-2014-10-29-audit.0.gz</body-file>
      <time-collected>
      </time-collected>
      <cmd-tgt>file</cmd-tgt>
      <content-type>basic</content-type>
      <status>completed</status>
      <size-collected>6816</size-collected>
      <prio-num>43</prio-num>
      <seq-num>32</seq-num>
   </asup:ROW>
   <asup:ROW>
      <error>
      </error>
      <body-file>oncommand-um-logs-2014-10-29-ocumserver-debug.0.gz</body-file>
      <time-collected>
      </time-collected>
      <cmd-tgt>file</cmd-tgt>
      <content-type>basic</content-type>
      <status>completed</status>
      <size-collected>4269152</size-collected>
      <prio-num>44</prio-num>
      <seq-num>32</seq-num>
   </asup:ROW>
   <asup:ROW>
      <error>
      </error>
      <body-file>oncommand-um-logs-2014-10-29-ocumserver.0.gz</body-file>
      <time-collected>
      </time-collected>
      <cmd-tgt>file</cmd-tgt>
      <content-type>basic</content-type>
      <status>completed</status>
      <size-collected>86579</size-collected>
      <prio-num>45</prio-num>
      <seq-num>32</seq-num>
   </asup:ROW>
   <asup:ROW>
      <error>
      </error>
      <body-file>oncommand-um-logs-2014-10-30-audit.0.gz</body-file>
      <time-collected>
      </time-collected>
      <cmd-tgt>file</cmd-tgt>
      <content-type>basic</content-type>
      <status>completed</status>
      <size-collected>13133</size-collected>
      <prio-num>46</prio-num>
      <seq-num>32</seq-num>
   </asup:ROW>
   <asup:ROW>
      <error>
      </error>
      <body-file>oncommand-um-logs-2014-10-30-ocumserver-debug.0.gz</body-file>
      <time-collected>
      </time-collected>
      <cmd-tgt>file</cmd-tgt>
      <content-type>basic</content-type>
      <status>completed</status>
      <size-collected>4323748</size-collected>
      <prio-num>47</prio-num>
      <seq-num>32</seq-num>
   </asup:ROW>
   <asup:ROW>
      <error>
      </error>
      <body-file>oncommand-um-logs-2014-10-30-ocumserver.0.gz</body-file>
      <time-collected>
      </time-collected>
      <cmd-tgt>file</cmd-tgt>
      <content-type>basic</content-type>
      <status>completed</status>
      <size-collected>86316</size-collected>
      <prio-num>48</prio-num>
      <seq-num>32</seq-num>
   </asup:ROW>
   <asup:ROW>
      <error>
      </error>
      <body-file>oncommand-um-logs-2014-11-02-ocumserver-debug.0.gz</body-file>
      <time-collected>
      </time-collected>
      <cmd-tgt>file</cmd-tgt>
      <content-type>basic</content-type>
      <status>completed</status>
      <size-collected>5539224</size-collected>
      <prio-num>49</prio-num>
      <seq-num>32</seq-num>
   </asup:ROW>
   <asup:ROW>
      <error>
      </error>
      <body-file>oncommand-um-logs-2014-11-02-audit.0.gz</body-file>
      <time-collected>
      </time-collected>
      <cmd-tgt>file</cmd-tgt>
      <content-type>basic</content-type>
      <status>completed</status>
      <size-collected>14613</size-collected>
      <prio-num>50</prio-num>
      <seq-num>32</seq-num>
   </asup:ROW>
   <asup:ROW>
      <error>
      </error>
      <body-file>oncommand-um-logs-2014-11-02-ocumserver.0.gz</body-file>
      <time-collected>
      </time-collected>
      <cmd-tgt>file</cmd-tgt>
      <content-type>basic</content-type>
      <status>completed</status>
      <size-collected>94111</size-collected>
      <prio-num>51</prio-num>
      <seq-num>32</seq-num>
   </asup:ROW>
   <asup:ROW>
      <error>
      </error>
      <body-file>oncommand-um-logs-2014-11-03-ocumserver-debug.0.gz</body-file>
      <time-collected>
      </time-collected>
      <cmd-tgt>file</cmd-tgt>
      <content-type>basic</content-type>
      <status>completed</status>
      <size-collected>6326700</size-collected>
      <prio-num>52</prio-num>
      <seq-num>32</seq-num>
   </asup:ROW>
   <asup:ROW>
      <error>
      </error>
      <body-file>oncommand-um-logs-2014-11-03-ocumserver.0.gz</body-file>
      <time-collected>
      </time-collected>
      <cmd-tgt>file</cmd-tgt>
      <content-type>basic</content-type>
      <status>completed</status>
      <size-collected>101120</size-collected>
      <prio-num>53</prio-num>
      <seq-num>32</seq-num>
   </asup:ROW>
   <asup:ROW>
      <error>
      </error>
      <body-file>oncommand-um-logs-2014-11-03-audit.0.gz</body-file>
      <time-collected>
      </time-collected>
      <cmd-tgt>file</cmd-tgt>
      <content-type>basic</content-type>
      <status>completed</status>
      <size-collected>13359</size-collected>
      <prio-num>54</prio-num>
      <seq-num>32</seq-num>
   </asup:ROW>
   <asup:ROW>
      <error>
      </error>
      <body-file>oncommand-um-logs-2014-10-08-audit.0.gz</body-file>
      <time-collected>
      </time-collected>
      <cmd-tgt>file</cmd-tgt>
      <content-type>basic</content-type>
      <status>completed</status>
      <size-collected>11704</size-collected>
      <prio-num>55</prio-num>
      <seq-num>32</seq-num>
   </asup:ROW>
   <asup:ROW>
      <error>
      </error>
      <body-file>oncommand-um-logs-2014-10-08-ocumserver-debug.0.gz</body-file>
      <time-collected>
      </time-collected>
      <cmd-tgt>file</cmd-tgt>
      <content-type>basic</content-type>
      <status>completed</status>
      <size-collected>6042891</size-collected>
      <prio-num>56</prio-num>
      <seq-num>32</seq-num>
   </asup:ROW>
   <asup:ROW>
      <error>
      </error>
      <body-file>oncommand-um-logs-2014-10-08-ocumserver.0.gz</body-file>
      <time-collected>
      </time-collected>
      <cmd-tgt>file</cmd-tgt>
      <content-type>basic</content-type>
      <status>completed</status>
      <size-collected>98329</size-collected>
      <prio-num>57</prio-num>
      <seq-num>32</seq-num>
   </asup:ROW>
   <asup:ROW>
      <error>
      </error>
      <body-file>oncommand-um-logs-2014-10-12-audit.0.gz</body-file>
      <time-collected>
      </time-collected>
      <cmd-tgt>file</cmd-tgt>
      <content-type>basic</content-type>
      <status>completed</status>
      <size-collected>10306</size-collected>
      <prio-num>58</prio-num>
      <seq-num>32</seq-num>
   </asup:ROW>
   <asup:ROW>
      <error>
      </error>
      <body-file>oncommand-um-logs-2014-10-12-ocumserver-debug.0.gz</body-file>
      <time-collected>
      </time-collected>
      <cmd-tgt>file</cmd-tgt>
      <content-type>basic</content-type>
      <status>completed</status>
      <size-collected>6142300</size-collected>
      <prio-num>59</prio-num>
      <seq-num>32</seq-num>
   </asup:ROW>
   <asup:ROW>
      <error>
      </error>
      <body-file>oncommand-um-logs-2014-10-12-ocumserver.0.gz</body-file>
      <time-collected>
      </time-collected>
      <cmd-tgt>file</cmd-tgt>
      <content-type>basic</content-type>
      <status>completed</status>
      <size-collected>98978</size-collected>
      <prio-num>60</prio-num>
      <seq-num>32</seq-num>
   </asup:ROW>
   <asup:ROW>
      <error>
      </error>
      <body-file>oncommand-um-logs-2014-10-11-ocumserver-debug.0.gz</body-file>
      <time-collected>
      </time-collected>
      <cmd-tgt>file</cmd-tgt>
      <content-type>basic</content-type>
      <status>completed</status>
      <size-collected>6148868</size-collected>
      <prio-num>61</prio-num>
      <seq-num>32</seq-num>
   </asup:ROW>
   <asup:ROW>
      <error>
      </error>
      <body-file>oncommand-um-logs-2014-10-11-audit.0.gz</body-file>
      <time-collected>
      </time-collected>
      <cmd-tgt>file</cmd-tgt>
      <content-type>basic</content-type>
      <status>completed</status>
      <size-collected>11655</size-collected>
      <prio-num>62</prio-num>
      <seq-num>32</seq-num>
   </asup:ROW>
   <asup:ROW>
      <error>
      </error>
      <body-file>oncommand-um-logs-2014-10-11-ocumserver.0.gz</body-file>
      <time-collected>
      </time-collected>
      <cmd-tgt>file</cmd-tgt>
      <content-type>basic</content-type>
      <status>completed</status>
      <size-collected>98717</size-collected>
      <prio-num>63</prio-num>
      <seq-num>32</seq-num>
   </asup:ROW>
   <asup:ROW>
      <error>
      </error>
      <body-file>oncommand-um-logs-2014-10-17-audit.0.gz</body-file>
      <time-collected>
      </time-collected>
      <cmd-tgt>file</cmd-tgt>
      <content-type>basic</content-type>
      <status>completed</status>
      <size-collected>7659</size-collected>
      <prio-num>64</prio-num>
      <seq-num>32</seq-num>
   </asup:ROW>
   <asup:ROW>
      <error>
      </error>
      <body-file>oncommand-um-logs-2014-10-17-ocumserver-debug.0.gz</body-file>
      <time-collected>
      </time-collected>
      <cmd-tgt>file</cmd-tgt>
      <content-type>basic</content-type>
      <status>completed</status>
      <size-collected>6177932</size-collected>
      <prio-num>65</prio-num>
      <seq-num>32</seq-num>
   </asup:ROW>
   <asup:ROW>
      <error>
      </error>
      <body-file>oncommand-um-logs-2014-10-17-ocumserver.0.gz</body-file>
      <time-collected>
      </time-collected>
      <cmd-tgt>file</cmd-tgt>
      <content-type>basic</content-type>
      <status>completed</status>
      <size-collected>98594</size-collected>
      <prio-num>66</prio-num>
      <seq-num>32</seq-num>
   </asup:ROW>
   <asup:ROW>
      <error>
      </error>
      <body-file>oncommand-um-logs-2014-10-14-ocumserver-debug.0.gz</body-file>